{
  "$schema": "https://srs.semanticops.com/schema/2.0/relation-type.json",
  "id": "b2000001-0000-4000-a000-000000000001",
  "version": 1,
  "key": "com.semanticops.srs/section-sequence",
  "namespace": "com.semanticops.srs",
  "label": "Section sequence",
  "description": "Orders top-level section records for composition rendering.",
  "category": "sequence",
  "irreflexive": true,
  "status": "deprecated",
  "createdAt": "2026-05-29T00:00:00Z"
}
